{
  "schemaVersion": 1,
  "eventId": "b2c3d4e5-f6a7-4890-b123-456789abcdef",
  "sequence": 1,
  "runId": "c3d4e5f6-a7b8-4901-c234-56789abcdef0",
  "projectId": "sample-app",
  "phaseId": "P00",
  "type": "run.created",
  "level": "info",
  "timestampUtc": "2026-08-02T08:00:00Z",
  "message": "Run created",
  "payload": {}
}
